{
  "lesson_id":"L-04-01","lesson_title":"Text analysis workloads","lesson_type":"concept_lesson","chapter_id":"chapter-04","module_id":"ch4-m1","launch_tier":"launch_critical","source_mode":"source_grounded","supports_objectives":["AI901-D1-O5","AI901-D2-O5"],"supports_python_skills":["PY-016"],"prerequisite_lesson_ids":["L-03-03","L-02-01"],
  "source_ids":["OFFICIAL-AI901-STUDY-GUIDE","OFFICIAL-FOUNDRY-HUB","OFFICIAL-AZURE-LANGUAGE"],"activity_ids":["A-L0401-1","A-L0401-2"],"assessment_ids":["AS-L0401-QC","AS-L0401-SCEN"],
  "learner_starting_state":"Can handle JSON-shaped data and explain an offline client flow but has not mapped common text-analysis goals to capabilities.",
  "learner_ending_state":"Can select key phrase extraction, named entity recognition, sentiment analysis, or summarization and trace a lightweight document-ID/result/error flow.",
  "mastery_gate":"Score 12 of 12 on primary and fresh-transfer forms, demonstrate all four required text techniques on both forms, pass both client-flow items, and explain one choice without notes.",
  "estimated_minutes":55,"difficulty_band":"beginner_plus",
  "provenance_policy":{"citation_expectation":"AI-901 technique wording and Azure Language capabilities trace to current official Microsoft sources; scenarios, distractors, reasons, and gates are course-authored.","bridge_label_required":true,"unsupported_claim_behavior":"Reverify SDK packages, operation names, endpoints, authentication, languages, limits, regions, pricing, and preview status before live implementation."},
  "status":"review","notes":"Offline scenario and structured-result package; performs no service call."
}
