{"lesson_id":"L-05-02","lesson_title":"Prompts: system, user, and grounding","lesson_type":"walkthrough_lesson","chapter_id":"chapter-05","module_id":"ch5-m3","launch_tier":"launch_critical","source_mode":"source_grounded","supports_objectives":["AI901-D2-O1"],"supports_python_skills":["PY-004","PY-012"],"prerequisite_lesson_ids":["L-02-03","L-03-02"],"source_ids":["OFFICIAL-AI901-STUDY-GUIDE","OFFICIAL-FOUNDRY-HUB","OFFICIAL-FOUNDRY-PROMPT-PARAMETERS","OFFICIAL-FOUNDRY-SYSTEM-MESSAGES"],"activity_ids":["A-L0502-1","A-L0502-2"],"assessment_ids":["AS-L0502-PROMPT"],"learner_starting_state":"Can explain generative model behavior and write small functions but may mix durable instructions, user tasks, evidence, and output requirements.","learner_ending_state":"Can separate system and user roles, add grounding and an output contract, handle instruction conflict safely, and define a realistic prompt evaluation set.","mastery_gate":"Score 12 of 12 on primary and fresh-transfer forms across six prompt-design decisions, including destructive-action and prompt-injection safeguards, then explain one improved prompt without notes.","estimated_minutes":55,"difficulty_band":"beginner_plus","provenance_policy":{"citation_expectation":"AI-901 scope and current system/prompt guidance trace to official Microsoft sources; scenarios, reasons, and gates are course-authored.","bridge_label_required":true,"unsupported_claim_behavior":"Reverify current model-specific prompt guidance, supported roles/parameters, context limits, safety features, SDK/API shapes, and deprecations before live use."},"status":"review","notes":"Offline prompt-design package; sends no prompt to a service and authorizes no external action."}
