{"lesson_id":"L-05-01","lesson_title":"Foundry portal orientation","lesson_type":"portal_navigation_lab","chapter_id":"chapter-05","module_id":"ch5-m1","launch_tier":"launch_critical","source_mode":"source_grounded","supports_objectives":["AI901-D2-O2"],"supports_python_skills":["PY-017","PY-019"],"prerequisite_lesson_ids":["L-02-03","L-03-03"],"source_ids":["OFFICIAL-AI901-STUDY-GUIDE","OFFICIAL-FOUNDRY-HUB","OFFICIAL-FOUNDRY-RESOURCE-QUICKSTART","OFFICIAL-FOUNDRY-SDK"],"activity_ids":["A-L0501-1","A-L0501-2","A-L0501-3"],"assessment_ids":["AS-L0501-ORDER"],"learner_starting_state":"Can explain model/deployment choices and safe client configuration but has not yet organized the Foundry portal workflow.","learner_ending_state":"Can safely orient from access and project selection through model deployment, readiness verification, portal interaction, and connection-detail handoff.","mastery_gate":"Score 16 of 16 on primary and fresh-transfer forms across eight portal workflow decisions, including access, project, deployment, interaction, endpoint/deployment-name, and cleanup safeguards, then explain the flow without notes.","estimated_minutes":60,"difficulty_band":"beginner_plus","provenance_policy":{"citation_expectation":"Portal workflow and current project/deployment concepts trace to official Microsoft sources; scenario wording, reasons, and gates are course-authored.","bridge_label_required":true,"unsupported_claim_behavior":"Reverify portal labels/navigation, model availability, roles, regions, deployment options, quotas, pricing, preview status, endpoints, and cleanup behavior immediately before live use."},"status":"review","notes":"Offline portal rehearsal; creates, deploys, prompts, or deletes no Azure resource."}
