{"lesson_id":"L-06-01","lesson_title":"Objective-by-objective mastery review","lesson_type":"exam_objective_review_lesson","chapter_id":"chapter-06","module_id":"ch6-m1","launch_tier":"launch_critical","source_mode":"source_grounded","supports_objectives":["AI901-D1-O1","AI901-D1-O2","AI901-D1-O3","AI901-D1-O4","AI901-D1-O5","AI901-D1-O6","AI901-D1-O7","AI901-D1-O8","AI901-D2-O1","AI901-D2-O2","AI901-D2-O3","AI901-D2-O4","AI901-D2-O5","AI901-D2-O6","AI901-D2-O7"],"supports_python_skills":["PY-019","PY-020"],"prerequisite_lesson_ids":["L-05-07"],"source_ids":["OFFICIAL-AI901-STUDY-GUIDE","OFFICIAL-FOUNDRY-HUB","OFFICIAL-FOUNDRY-SDK","OFFICIAL-FOUNDRY-AGENTS","OFFICIAL-FOUNDRY-RESPONSIBLE-AI","OFFICIAL-GENAI-CONCEPTS","OFFICIAL-AZURE-LANGUAGE","OFFICIAL-AZURE-SPEECH","OFFICIAL-AZURE-VISION","OFFICIAL-CONTENT-UNDERSTANDING"],"activity_ids":["A-L0601-1","A-L0601-2"],"assessment_ids":["AS-L0601-OBJ"],"learner_starting_state":"Has completed every mapped concept and Foundry implementation lesson through Content Understanding.","learner_ending_state":"Can map evidence to every current AI-901 objective, distinguish conceptual from implementation evidence, and mark each objective ready or remediate without relying on confidence alone.","mastery_gate":"Score 30 of 30 on primary and fresh-transfer forms, covering objective selection and evidence for all 15 AI-901 objectives, with no objective left unassessed and a closed-note domain explanation.","estimated_minutes":70,"difficulty_band":"intermediate","provenance_policy":{"citation_expectation":"The current AI-901 study guide controls objective names and scope; official Microsoft Foundry and Azure AI pages support current product claims.","bridge_label_required":true,"unsupported_claim_behavior":"Reverify exam objectives, weights, portal labels, SDK/APIs, model and tool availability, pricing, previews, and deprecations before the final readiness decision."},"status":"review","notes":"Offline review only; this lesson makes no service call or external decision and does not claim Microsoft exam questions or guaranteed exam results."}
