{"lesson_id":"L-06-02","lesson_title":"Weak-area remediation planner","lesson_type":"recovery_lesson_after_repeated_failure","chapter_id":"chapter-06","module_id":"ch6-m2","launch_tier":"launch_critical","source_mode":"learner_state_routed_to_official_sources","supports_objectives":[],"supports_python_skills":["PY-007","PY-016","PY-017"],"prerequisite_lesson_ids":["L-06-01"],"source_ids":["OFFICIAL-AI901-STUDY-GUIDE","OFFICIAL-FOUNDRY-HUB","OFFICIAL-FOUNDRY-SDK","OFFICIAL-FOUNDRY-AGENTS","OFFICIAL-CONTENT-UNDERSTANDING"],"activity_ids":["A-L0602-1","A-L0602-2"],"assessment_ids":["AS-L0602-PLAN"],"learner_starting_state":"Has an objective ledger containing ready, remediate, and possibly not-yet-assessed statuses with attempt evidence.","learner_ending_state":"Can turn every weak objective into a source-backed, bounded remediation route with retrieval, guided practice, fresh transfer, and an evidence-based reassessment rule.","mastery_gate":"Score 12 of 12 on primary and fresh-transfer planning forms across six remediation boundaries and produce a source-backed route for every weak objective without confidence or exam-claim bypass.","estimated_minutes":45,"difficulty_band":"beginner_plus","provenance_policy":{"citation_expectation":"Current objective wording comes from the official AI-901 study guide; implementation remediation routes return to current official Foundry sources.","bridge_label_required":true,"unsupported_claim_behavior":"Reverify exam objectives/weights and volatile portal, SDK/API, model, tool, price, preview, and deprecation details before reassessment."},"status":"review","notes":"Offline planning only. The lesson does not predict or guarantee an exam result and authorizes no service, Azure, credential, or external action."}
