{"lesson_id":"L-04-04","lesson_title":"Information extraction workloads","lesson_type":"source_grounded_explainer_lesson","chapter_id":"chapter-04","module_id":"ch4-m3","launch_tier":"launch_critical","source_mode":"source_grounded","supports_objectives":["AI901-D1-O8"],"supports_python_skills":["PY-016","PY-020"],"prerequisite_lesson_ids":["L-04-01","L-04-03"],"source_ids":["OFFICIAL-AI901-STUDY-GUIDE","OFFICIAL-FOUNDRY-HUB","OFFICIAL-CONTENT-UNDERSTANDING","OFFICIAL-CONTENT-UNDERSTANDING-ANALYZER"],"activity_ids":["A-L0404-1","A-L0404-2"],"assessment_ids":["AS-L0404-SCEN"],"learner_starting_state":"Can distinguish text and visual workloads but may confuse general description with schema-driven extraction.","learner_ending_state":"Can identify extraction from documents/forms, images, audio, and video and protect structured output with explicit schemas, null preservation, and evidence-aware review.","mastery_gate":"Score 12 of 12 on primary and fresh-transfer forms across four modalities plus schema and missing-value safeguards, then explain one extraction choice without notes.","estimated_minutes":55,"difficulty_band":"beginner_plus","provenance_policy":{"citation_expectation":"AI-901 scope and current Content Understanding analyzer concepts trace to official Microsoft sources; scenarios, reasons, and gates are course-authored.","bridge_label_required":true,"unsupported_claim_behavior":"Reverify analyzer schema, supported types/formats/languages, SDK/REST operations, API version, limits, regions, pricing, and preview/deprecation status before live use."},"status":"review","notes":"Offline conceptual package; later L-05-07 provides the implementation-oriented multimodal extraction lab."
}
